{
  "$schema": "https://json-schema.org/draft/2020-12/schema",
  "$id": "https://github.com/erkmangelis/dotNET-Template/blob/main/schemas/ek-spec.schema.json",
  "title": "ek-api project spec",
  "description": "A request to generate a project, and the provenance (template-origin.json) of a generated one. Generated by \u0060ek schema\u0060 from catalog/.",
  "type": "object",
  "additionalProperties": false,
  "properties": {
    "$schema": {
      "type": "string"
    },
    "specVersion": {
      "description": "The spec format version.",
      "const": 1
    },
    "template": {
      "description": "The template, by identity or short name.",
      "enum": [
        "Erkmangelis.Templates.Api",
        "ek-api"
      ]
    },
    "package": {
      "description": "The template package.",
      "const": "Erkmangelis.Templates"
    },
    "version": {
      "description": "The template package version that generated, or should generate, the project.",
      "type": "string"
    },
    "name": {
      "description": "The project name, used for namespaces, project files and the solution.",
      "type": "string",
      "pattern": "^[A-Za-z][A-Za-z0-9_]*(\\.[A-Za-z][A-Za-z0-9_]*)*$"
    },
    "preset": {
      "description": "A named starting point. Options given next to it win over its values.",
      "enum": [
        "minimal",
        "saas-api",
        "api-worker",
        "ek-worker",
        "sso-api",
        "single-box"
      ]
    },
    "options": {
      "description": "Template options. An option left out takes the value a rule needs, or its default.",
      "type": "object",
      "additionalProperties": false,
      "properties": {
        "auth": {
          "description": "Authentication. Every choice except \u0027none\u0027 needs a database, and turns PostgreSQL on when --db is none.",
          "enum": [
            "none",
            "identity",
            "external",
            "oidc"
          ],
          "default": "none"
        },
        "db": {
          "description": "Database, through EF Core with migrations, audit history and a compose deployment.",
          "enum": [
            "none",
            "postgres",
            "sqlserver",
            "sqlite"
          ],
          "default": "none"
        },
        "email": {
          "description": "Email delivery. \u0027smtp\u0027 adds an email transport (SMTP with MailKit, or the log in development) and templated messages.",
          "enum": [
            "none",
            "smtp"
          ],
          "default": "none"
        },
        "jobs": {
          "description": "Background jobs. \u0027hangfire\u0027 needs a database, and turns PostgreSQL on when --db is none.",
          "enum": [
            "none",
            "hosted",
            "hangfire"
          ],
          "default": "none"
        },
        "worker": {
          "description": "Add a worker project that runs the API\u0027s jobs in its own process and container. Implies --jobs hangfire.",
          "type": "boolean",
          "default": false
        },
        "aspire": {
          "description": "Add a .NET Aspire AppHost that starts the API, the worker and the database for local development.",
          "type": "boolean",
          "default": false
        },
        "agents": {
          "description": "Guidance files for AI coding agents.",
          "enum": [
            "none",
            "shared",
            "claude"
          ],
          "default": "shared"
        }
      }
    }
  }
}
