{
  "specVersion": 1,
  "template": "Erkmangelis.Templates.Api",
  "package": "Erkmangelis.Templates",
  "version": "0.5.0",
  "name": "Acme.Notes",
  "options": {
    "auth": "identity",
    "db": "postgres",
    "email": "none",
    "jobs": "hangfire",
    "worker": true,
    "aspire": true,
    "agents": "claude"
  }
}
